{
  "$schema": "https://json-schema.org/draft/2020-12/schema",
  "type": "object",
  "additionalProperties": false,
  "required": [
    "schema_version",
    "skill",
    "language",
    "context",
    "sources",
    "content"
  ],
  "properties": {
    "schema_version": {
      "const": "1.0"
    },
    "skill": {
      "const": "tw-edu-curriculum-mapper"
    },
    "language": {
      "const": "zh-TW"
    },
    "context": {
      "type": "object",
      "additionalProperties": false,
      "required": [
        "subject",
        "grade",
        "topic"
      ],
      "properties": {
        "subject": {
          "type": "string",
          "minLength": 1
        },
        "grade": {
          "type": "string",
          "minLength": 1
        },
        "topic": {
          "type": "string",
          "minLength": 1
        }
      }
    },
    "sources": {
      "type": "array",
      "items": {
        "type": "object",
        "additionalProperties": false,
        "required": [
          "title",
          "status"
        ],
        "properties": {
          "title": {
            "type": "string",
            "minLength": 1
          },
          "url": {
            "type": "string"
          },
          "status": {
            "enum": [
              "verified",
              "user_provided",
              "pending"
            ]
          }
        }
      }
    },
    "content": {
      "type": "object",
      "additionalProperties": false,
      "required": [
        "title",
        "units"
      ],
      "properties": {
        "title": {
          "type": "string",
          "minLength": 1
        },
        "units": {
          "type": "array",
          "minItems": 1,
          "items": {
            "type": "object",
            "additionalProperties": false,
            "required": [
              "name",
              "weeks",
              "periods",
              "goals",
              "codes",
              "assessments"
            ],
            "properties": {
              "name": {
                "type": "string",
                "minLength": 1
              },
              "weeks": {
                "type": "string",
                "minLength": 1
              },
              "periods": {
                "type": "integer",
                "minimum": 1
              },
              "goals": {
                "type": "array",
                "minItems": 1,
                "items": {
                  "type": "string",
                  "minLength": 1
                }
              },
              "codes": {
                "type": "array",
                "minItems": 0,
                "items": {
                  "type": "object",
                  "additionalProperties": false,
                  "required": [
                    "code",
                    "description",
                    "verified"
                  ],
                  "properties": {
                    "code": {
                      "type": "string",
                      "minLength": 1
                    },
                    "description": {
                      "type": "string",
                      "minLength": 1
                    },
                    "verified": {
                      "type": "boolean"
                    },
                    "verification_note": {
                      "type": "string",
                      "minLength": 1
                    }
                  }
                }
              },
              "assessments": {
                "type": "array",
                "minItems": 1,
                "items": {
                  "type": "string",
                  "minLength": 1
                }
              }
            }
          }
        },
        "school_events": {
          "type": "array",
          "minItems": 1,
          "items": {
            "type": "object",
            "additionalProperties": false,
            "required": [
              "week",
              "event"
            ],
            "properties": {
              "week": {
                "type": "string",
                "minLength": 1
              },
              "event": {
                "type": "string",
                "minLength": 1
              }
            }
          }
        }
      }
    }
  }
}
